{
  "id": "expertise-led",
  "name": "Expertise-led (merit-weighted)",
  "description": "Weight comes from domain knowledge, not rank: a subject expert's feedback on their area carries more weight even without authority over the presenter. Decouples credibility from hierarchy.",
  "basis": "expertise",
  "weights": { "above": 1.1, "peer": 1.0, "below": 1.0, "unknown": 1.0 },
  "expertiseBoost": 0.6,
  "promoteToDecision": [],
  "balancing": true
}
